,text,date,text_no_link
331,"Chris Jacobs (@JacobsNY27) will be a tremendous Congressman who will always fight for New York. He is Strong on the Border, our Military and Vets, and the Second Amendment. Chris has my Complete and Total Endorsement! Vote for Chris on June 23! #NY27 https://t.co/LYowAxQqfp",2020-06-16 23:18:17,"Chris Jacobs (@JacobsNY27) will be a tremendous Congressman who will always fight for New York. He is Strong on the Border, our Military and Vets, and the Second Amendment. Chris has my Complete and Total Endorsement! Vote for Chris on June 23! #NY27"
333,"Wow! May retail sales show biggest one-month increase of ALL TIME, up 17.7%. Far bigger than projected. Looks like a BIG DAY FOR THE STOCK MARKET, AND JOBS!",2020-06-16 12:39:02,"Wow! May retail sales show biggest one-month increase of ALL TIME, up 17.7%. Far bigger than projected. Looks like a BIG DAY FOR THE STOCK MARKET, AND JOBS!"
334,So true! https://t.co/E8Fy0zuKQB,2020-06-16 03:48:48,So true!
335,“Trump team should get 'a lot of credit' for fast coronavirus stimulus: CBO” https://t.co/TGVxgIfTAa,2020-06-15 21:09:09,“Trump team should get 'a lot of credit' for fast coronavirus stimulus: CBO”
336,"“We have greater confidence in our call for a V-shaped recovery, given recent upside surprises in growth data and policy action.” Chetan Ahya, Chief Economist at Morgan Stanley",2020-06-15 21:08:55,"“We have greater confidence in our call for a V-shaped recovery, given recent upside surprises in growth data and policy action.” Chetan Ahya, Chief Economist at Morgan Stanley"
337,LAW & ORDER!,2020-06-15 14:19:56,LAW & ORDER!
338,"Our testing is so much bigger and more advanced than any other country (we have done a great job on this!) that it shows more cases. Without testing, or weak testing, we would be showing almost no cases. Testing is a double edged sword - Makes us look bad, but good to have!!!",2020-06-15 14:14:26,"Our testing is so much bigger and more advanced than any other country (we have done a great job on this!) that it shows more cases. Without testing, or weak testing, we would be showing almost no cases. Testing is a double edged sword - Makes us look bad, but good to have!!!"
339,"The Far Left Fake News Media, which had no Covid problem with the Rioters & Looters destroying Democrat run cities, is trying to Covid Shame us on our big Rallies. Won’t work!",2020-06-15 14:02:15,"The Far Left Fake News Media, which had no Covid problem with the Rioters & Looters destroying Democrat run cities, is trying to Covid Shame us on our big Rallies. Won’t work!"
340,"Almost One Million people request tickets for the Saturday Night Rally in Tulsa, Oklahoma!",2020-06-15 13:28:03,"Almost One Million people request tickets for the Saturday Night Rally in Tulsa, Oklahoma!"
341,"I’ve done more in less than 4 years than Biden’s done in more than 40 years, including for Black America. Biden has been a part of every failed decision for decades. Bad Trade Deals, Endless Wars, you name it, he has shown a complete lack of leadership. He’s weak & shot!!!",2020-06-15 12:43:39,"I’ve done more in less than 4 years than Biden’s done in more than 40 years, including for Black America. Biden has been a part of every failed decision for decades. Bad Trade Deals, Endless Wars, you name it, he has shown a complete lack of leadership. He’s weak & shot!!!"
342,Many Democrats want to Defund and Abolish Police Departments. HOW CRAZY!,2020-06-15 02:54:31,Many Democrats want to Defund and Abolish Police Departments. HOW CRAZY!
343,THE SILENT MAJORITY IS STRONGER THAN EVER!!!,2020-06-14 21:54:50,THE SILENT MAJORITY IS STRONGER THAN EVER!!!
344,"Interesting how ANTIFA and other Far Left militant groups can take over a city without barely a wimpier from soft Do Nothing Democrat leadership,  yet these same weak leaders become RADICAL when it comes to shutting down a state or city and its hard working, tax paying citizens!",2020-06-14 20:47:02,"Interesting how ANTIFA and other Far Left militant groups can take over a city without barely a wimpier from soft Do Nothing Democrat leadership, yet these same weak leaders become RADICAL when it comes to shutting down a state or city and its hard working, tax paying citizens!"
345,Does anyone notice how little the Radical Left takeover of Seattle is being discussed in the Fake News Media. That is very much on purpose because they know how badly this weakness & ineptitude play politically. The Mayor & Governor should be ashamed of themselves. Easily fixed!,2020-06-14 20:34:35,Does anyone notice how little the Radical Left takeover of Seattle is being discussed in the Fake News Media. That is very much on purpose because they know how badly this weakness & ineptitude play politically. The Mayor & Governor should be ashamed of themselves. Easily fixed!
347,Thank you Philip! https://t.co/jGspqbtSgL,2020-06-14 13:15:03,Thank you Philip!
348,"Michael Moore: I‘m ‘Begging‘ Dems -- Don‘t Underestimate White Male Trump Supporter‘s ‘Rage,‘ ‘Emotion‘ https://t.co/IktLtIZNgZ via @BreitbartNews Well, he got it right in 2016?",2020-06-14 13:12:04,"Michael Moore: I‘m ‘Begging‘ Dems -- Don‘t Underestimate White Male Trump Supporter‘s ‘Rage,‘ ‘Emotion‘ via @BreitbartNews Well, he got it right in 2016?"
349,A great day at West Point! https://t.co/oJyXsI8RG6,2020-06-14 03:26:00,A great day at West Point!
350,"The ramp that I descended after my West Point Commencement speech was very long & steep, had no handrail and, most importantly, was very slippery. The last thing I was going to do is “fall” for the Fake News to have fun with. Final ten feet I ran down to level ground. Momentum!",2020-06-14 02:57:43,"The ramp that I descended after my West Point Commencement speech was very long & steep, had no handrail and, most importantly, was very slippery. The last thing I was going to do is “fall” for the Fake News to have fun with. Final ten feet I ran down to level ground. Momentum!"
351,"And it looks like the NFL is heading in that direction also, but not with me watching! https://t.co/aGfBaK7RNA",2020-06-13 21:17:58,"And it looks like the NFL is heading in that direction also, but not with me watching!"
352,I won’t be watching much anymore! https://t.co/s8nCg9EJSW,2020-06-13 21:13:22,I won’t be watching much anymore!
353,Tonight at 9:00 P.M. (Eastern). https://t.co/8LYU9GLoTj,2020-06-13 21:12:20,Tonight at 9:00 P.M. (Eastern).
354,"On behalf of our entire nation, CONGRATULATIONS to the incredible West Point Class of 2020! https://t.co/mXBXmRDBbP",2020-06-13 20:33:31,"On behalf of our entire nation, CONGRATULATIONS to the incredible West Point Class of 2020!"
355,MAKE AMERICA GREAT AGAIN!,2020-06-13 12:24:25,MAKE AMERICA GREAT AGAIN!
356,LAW & ORDER!,2020-06-13 12:23:47,LAW & ORDER!
357,10:00 A.M. https://t.co/TGUVzlT0My,2020-06-13 11:57:06,10:00 A.M.
358,So true! https://t.co/CSjsY2v3ex,2020-06-13 11:53:35,So true!
359,Happy Birthday Matt. GREAT JOB! https://t.co/5fLrS7F3DE,2020-06-13 11:53:03,Happy Birthday Matt. GREAT JOB!
360,"Thank you Frank. Fredo’s ratings are really bad, more than 50% down. A loser!!! https://t.co/DGaSYhqJVj",2020-06-13 11:51:42,"Thank you Frank. Fredo’s ratings are really bad, more than 50% down. A loser!!!"
361,They want to totally destroy our great Police Departments. No way!!! https://t.co/pN1azBRVT5,2020-06-13 11:48:25,They want to totally destroy our great Police Departments. No way!!!
362,Thank you Nick. Hear the book is doing well (go get it everyone. Make this great writer number one!). https://t.co/SM7xBuuwPe,2020-06-13 11:41:17,Thank you Nick. Hear the book is doing well (go get it everyone. Make this great writer number one!).
363,Soon heading to West Point Graduation to give the Commencement Address. Will be shown live on @FoxNews plus. Enjoy!,2020-06-13 11:36:58,Soon heading to West Point Graduation to give the Commencement Address. Will be shown live on @FoxNews plus. Enjoy!
364,Concast is known for its terrible service. On top of that they provide FAKE NEWS on MSDNC & @NBCNews. Drop them and go to a good provider! https://t.co/Ew4cB2UPv4,2020-06-13 11:29:40,Concast is known for its terrible service. On top of that they provide FAKE NEWS on MSDNC & @NBCNews. Drop them and go to a good provider!
365,We are getting the Commercial Fishing Industry in Maine back on track (will be better than ever) after suffering years of stupidity and abuse from the previous administration. Already got 5000 square miles back and available to fish. China & E.U. told to drop their Tariffs now!!! https://t.co/EcRxd2qWWW,2020-06-13 11:22:21,We are getting the Commercial Fishing Industry in Maine back on track (will be better than ever) after suffering years of stupidity and abuse from the previous administration. Already got 5000 square miles back and available to fish. China & E.U. told to drop their Tariffs now!!!
366,Criminal Justice Reform. I got it done!!! https://t.co/HsaYwWuvUE,2020-06-13 11:15:33,Criminal Justice Reform. I got it done!!!
367,Thank you Jack! https://t.co/i3h7Yd8nLG,2020-06-13 11:12:10,Thank you Jack!
368,"We had previously scheduled our #MAGA Rally in Tulsa, Oklahoma, for June 19th – a big deal. Unfortunately, however, this would fall on the Juneteenth Holiday. Many of my African American friends and supporters have reached out to suggest that we consider changing the date out...",2020-06-13 03:23:13,"We had previously scheduled our #MAGA Rally in Tulsa, Oklahoma, for June 19th – a big deal. Unfortunately, however, this would fall on the Juneteenth Holiday. Many of my African American friends and supporters have reached out to suggest that we consider changing the date out..."
369,"Just finished dinner in Bedminster, New Jersey, with Governor Phil Murphy (@GovMurphy) and his wonderful wife, Tammy. Talked about many things, including the opening of the beautiful Garden State, getting people back to work, and...",2020-06-13 03:20:24,"Just finished dinner in Bedminster, New Jersey, with Governor Phil Murphy (@GovMurphy) and his wonderful wife, Tammy. Talked about many things, including the opening of the beautiful Garden State, getting people back to work, and..."
370,"Corky Messner (@CorkyForSenate) will be a fantastic Senator for New Hampshire! A West Point graduate, he served our Country in the Army with distinction. Strong on Jobs, Crime, Vets, Military and the Second Amendment...",2020-06-12 16:39:39,"Corky Messner (@CorkyForSenate) will be a fantastic Senator for New Hampshire! A West Point graduate, he served our Country in the Army with distinction. Strong on Jobs, Crime, Vets, Military and the Second Amendment..."
371,"Seattle Mayor says, about the anarchists takeover of her city, “it is a Summer of Love”. These Liberal Dems don’t have a clue. The terrorists burn and pillage our cities, and they think it is just wonderful, even the death. Must end this Seattle takeover now!",2020-06-12 14:15:27,"Seattle Mayor says, about the anarchists takeover of her city, “it is a Summer of Love”. These Liberal Dems don’t have a clue. The terrorists burn and pillage our cities, and they think it is just wonderful, even the death. Must end this Seattle takeover now!"
372,"Interview with @HARRISFAULKNER at 1:00 P.M. on @FoxNews, Outnumbered Overtime",2020-06-12 13:12:42,"Interview with @HARRISFAULKNER at 1:00 P.M. on @FoxNews, Outnumbered Overtime"
373,“Do you think Suburban Women want to Defund the Police? I don’t think so.” @marcthiessen,2020-06-12 13:09:14,“Do you think Suburban Women want to Defund the Police? I don’t think so.” @marcthiessen
374,A big winner. Congratulations! https://t.co/ZsL3YA33H8,2020-06-12 13:07:07,A big winner. Congratulations!
375,Hello! https://t.co/2sUGvP5daB,2020-06-12 13:06:37,Hello!
376,"The Republican Party has not yet voted on a Platform. No rush. I prefer a new and updated Platform, short form, if possible.",2020-06-12 13:04:46,"The Republican Party has not yet voted on a Platform. No rush. I prefer a new and updated Platform, short form, if possible."
377,"How do you think China, Russia, Japan or others would do with him in a negotiation? We would have no Country left!!! https://t.co/3YlD1ufODX",2020-06-12 12:37:47,"How do you think China, Russia, Japan or others would do with him in a negotiation? We would have no Country left!!!"
378,Crazy! https://t.co/NIQIBhexKX,2020-06-12 11:53:04,Crazy!
379,People have no idea how Fake the Lamestream Media is! https://t.co/qc8c8C7Pin,2020-06-12 11:52:08,People have no idea how Fake the Lamestream Media is!
380,The Radical Left Democrats: First they try to take away your guns. Then they try to take away your police!,2020-06-12 01:24:35,The Radical Left Democrats: First they try to take away your guns. Then they try to take away your police!
381,"Great work @RepChipRoy, together we are keeping AMERICAN WORKERS employed! https://t.co/zYGM7ToHNm",2020-06-11 22:44:07,"Great work @RepChipRoy, together we are keeping AMERICAN WORKERS employed!"
382,"Congratulations to @KarenHandel on running a great race and terrific primary victory - 75%, despite tough competition. Previously beat Jon Ossoff who, after his 2017 Congressional failure, is now running against a GREAT Senator, David @PerdueSenate...",2020-06-11 20:04:21,"Congratulations to @KarenHandel on running a great race and terrific primary victory - 75%, despite tough competition. Previously beat Jon Ossoff who, after his 2017 Congressional failure, is now running against a GREAT Senator, David @PerdueSenate..."
383,"Senator @JoniErnst of IOWA has a new book, “Daughter of the Heartland: My Ode to the Country That Raised Me.” The first female combat veteran elected to serve in the U.S. Senate – Joni is as tough as they come and a true inspiration for women everywhere. Get her book today! https://t.co/yKxUBasreY",2020-06-11 19:53:17,"Senator @JoniErnst of IOWA has a new book, “Daughter of the Heartland: My Ode to the Country That Raised Me.” The first female combat veteran elected to serve in the U.S. Senate – Joni is as tough as they come and a true inspiration for women everywhere. Get her book today!"
384,"Few people have ever fought as strongly for Iowa as Senator @JoniErnst! A combat Veteran, her service to Iowa and our Country is remarkable! Joni is Strong on Crime, our Military, Vets, Low Taxes and will protect your #2A at all times...",2020-06-11 19:44:23,"Few people have ever fought as strongly for Iowa as Senator @JoniErnst! A combat Veteran, her service to Iowa and our Country is remarkable! Joni is Strong on Crime, our Military, Vets, Low Taxes and will protect your #2A at all times..."
385,"Matt @Mowers is a champion for the Great State of New Hampshire! He was a winner in my Administration and he will always put America First. Strong on our Military, Vets, Low Taxes and the...",2020-06-11 19:42:16,"Matt @Mowers is a champion for the Great State of New Hampshire! He was a winner in my Administration and he will always put America First. Strong on our Military, Vets, Low Taxes and the..."
386,"We need our Great David Perdue (@PerdueSenate) in the Senate to Drain the Swamp & Make America Great Again! His Radical Liberal opponent, Jon Ossoff (who we beat in 2017), supports LAWLESS Sanctuary Cities, wants to raise your taxes, & weaken our Great Military. He is a puppet...",2020-06-11 19:33:51,"We need our Great David Perdue (@PerdueSenate) in the Senate to Drain the Swamp & Make America Great Again! His Radical Liberal opponent, Jon Ossoff (who we beat in 2017), supports LAWLESS Sanctuary Cities, wants to raise your taxes, & weaken our Great Military. He is a puppet..."
387,"Chris @JacobsNY27 is a Great Winner and Fighter for New York. He will never let you down! Strong on Crime, Military, our Vets, Reducing Taxes, Regulations, and importantly, our #2A. Vote on June 23rd. Chris has my Complete and Total Endorsement! #NY27 https://t.co/LYowAy816X",2020-06-11 19:30:35,"Chris @JacobsNY27 is a Great Winner and Fighter for New York. He will never let you down! Strong on Crime, Military, our Vets, Reducing Taxes, Regulations, and importantly, our #2A. Vote on June 23rd. Chris has my Complete and Total Endorsement! #NY27"
388,"Despite very tough competition, @NancyMace had a tremendous victory on Tuesday in South Carolina’s 1st Congressional District. The first woman to graduate from the Citadel, she is a Great Warrior who we need in Washington now...",2020-06-11 19:29:28,"Despite very tough competition, @NancyMace had a tremendous victory on Tuesday in South Carolina’s 1st Congressional District. The first woman to graduate from the Citadel, she is a Great Warrior who we need in Washington now..."
389,"Seriously failed presidential candidate, Senator Elizabeth “Pocahontas” Warren, just introduced an Amendment on the renaming of many of our legendary Military Bases from which we trained to WIN two World Wars. Hopefully our great Republican Senators won’t fall for this!",2020-06-11 18:21:38,"Seriously failed presidential candidate, Senator Elizabeth “Pocahontas” Warren, just introduced an Amendment on the renaming of many of our legendary Military Bases from which we trained to WIN two World Wars. Hopefully our great Republican Senators won’t fall for this!"
390,"Radical Left Governor @JayInslee and the Mayor of Seattle are being taunted and played at a level that our great Country has never seen before. Take back your city NOW. If you don’t do it, I will. This is not a game. These ugly Anarchists must be stopped IMMEDIATELY. MOVE FAST!",2020-06-11 18:08:29,"Radical Left Governor @JayInslee and the Mayor of Seattle are being taunted and played at a level that our great Country has never seen before. Take back your city NOW. If you don’t do it, I will. This is not a game. These ugly Anarchists must be stopped IMMEDIATELY. MOVE FAST!"
391,Anarchists just took over Seattle and the Liberal Democrat Governor just said he knows “nothing about that”.,2020-06-11 17:24:33,Anarchists just took over Seattle and the Liberal Democrat Governor just said he knows “nothing about that”.
392,"June 14th just happens to be my birthday, thank you! Love our Boaters, Love our Country! #MAGA  
https://t.co/Om9pbHIaTU",2020-06-11 17:23:04,"June 14th just happens to be my birthday, thank you! Love our Boaters, Love our Country! #MAGA"
393,"The Federal Reserve is wrong so often. I see the numbers also, and do MUCH better than they do. We will have a very good Third Quarter, a great Fourth Quarter, and one of our best ever years in 2021. We will also soon have a Vaccine & Therapeutics/Cure. That’s my opinion. WATCH!",2020-06-11 15:07:35,"The Federal Reserve is wrong so often. I see the numbers also, and do MUCH better than they do. We will have a very good Third Quarter, a great Fourth Quarter, and one of our best ever years in 2021. We will also soon have a Vaccine & Therapeutics/Cure. That’s my opinion. WATCH!"
394,THOSE THAT DENY THEIR HISTORY ARE DOOMED TO REPEAT IT!,2020-06-11 14:09:59,THOSE THAT DENY THEIR HISTORY ARE DOOMED TO REPEAT IT!
395,Sleepy Joe Biden refuses to leave his basement “sanctuary” and tell his Radical Left BOSSES that they are heading in the wrong direction. Tell them to get out of Seattle now. Liberal Governor @JayInslee is looking “the fool”. LAW & ORDER!,2020-06-11 14:02:01,Sleepy Joe Biden refuses to leave his basement “sanctuary” and tell his Radical Left BOSSES that they are heading in the wrong direction. Tell them to get out of Seattle now. Liberal Governor @JayInslee is looking “the fool”. LAW & ORDER!
396,"Our great National Guard Troops who took care of the area around the White House could hardly believe how easy it was. “A walk in the park”, one said. The protesters, agitators, anarchists (ANTIFA), and others, were handled VERY easily by the Guard, D.C. Police, & S.S. GREAT JOB!",2020-06-11 12:49:46,"Our great National Guard Troops who took care of the area around the White House could hardly believe how easy it was. “A walk in the park”, one said. The protesters, agitators, anarchists (ANTIFA), and others, were handled VERY easily by the Guard, D.C. Police, & S.S. GREAT JOB!"
397,"Domestic Terrorists have taken over Seattle, run by Radical Left Democrats, of course. LAW & ORDER!",2020-06-11 03:38:11,"Domestic Terrorists have taken over Seattle, run by Radical Left Democrats, of course. LAW & ORDER!"
398,“Very troubled by Durham probe findings.” A.G. Bill Barr  @BretBaier  @FoxNews,2020-06-11 03:27:22,“Very troubled by Durham probe findings.” A.G. Bill Barr @BretBaier @FoxNews
399,...And the Trump family didn’t ask the Federal government for money to carry this and many other very expensive to carry properties! https://t.co/IakI8RiWfj,2020-06-11 02:36:23,...And the Trump family didn’t ask the Federal government for money to carry this and many other very expensive to carry properties!
400,LAW & ORDER!,2020-06-11 02:21:28,LAW & ORDER!
401,"So honored by Archbishop Viganò’s incredible letter to me. I hope everyone, religious or not, reads it! https://t.co/fVhkCz89g5",2020-06-10 22:17:51,"So honored by Archbishop Viganò’s incredible letter to me. I hope everyone, religious or not, reads it!"
402,"Congratulations to Dr. Rich McCormick (@RichforGA) on a BIG WIN in Georgia last night! We need you in Washington, D.C. badly. You have my Complete and Total Endorsement! #MAGA #GA07 https://t.co/5lvlSoaoU2",2020-06-10 21:37:33,"Congratulations to Dr. Rich McCormick (@RichforGA) on a BIG WIN in Georgia last night! We need you in Washington, D.C. badly. You have my Complete and Total Endorsement! #MAGA #GA07"
403,"Congratulations on last nights BIG WIN, @NancyMace! Keep up the great work so we can #MAGA! We need you in Washington fast. You have my Complete and Total Endorsement! #SC01 https://t.co/GBe7NJBztj",2020-06-10 21:23:30,"Congratulations on last nights BIG WIN, @NancyMace! Keep up the great work so we can #MAGA! We need you in Washington fast. You have my Complete and Total Endorsement! #SC01"
404,I am sending $219.9M to the San Diego area in CARES Act funding for @sdmts. These funds from @USDOT will be CRITICAL for economic recovery. We have to keep people moving safely and efficiently!,2020-06-10 21:22:00,I am sending $219.9M to the San Diego area in CARES Act funding for @sdmts. These funds from @USDOT will be CRITICAL for economic recovery. We have to keep people moving safely and efficiently!
405,"Big $$$$ headed to the Pittsburgh area! I’m sending $141.7M in CARES Act funding to @PGHtransit from @USDOT to aid in the recovery. This will be critical to helping people get where they need to go and more importantly, keeping them SAFE!",2020-06-10 21:21:12,"Big $$$$ headed to the Pittsburgh area! I’m sending $141.7M in CARES Act funding to @PGHtransit from @USDOT to aid in the recovery. This will be critical to helping people get where they need to go and more importantly, keeping them SAFE!"
406,"It has been suggested that we should rename as many as 10 of our Legendary Military Bases, such as Fort Bragg in North Carolina, Fort Hood in Texas, Fort Benning in Georgia, etc. These Monumental and very Powerful Bases have become part of a Great American Heritage, and a...",2020-06-10 18:40:37,"It has been suggested that we should rename as many as 10 of our Legendary Military Bases, such as Fort Bragg in North Carolina, Fort Hood in Texas, Fort Benning in Georgia, etc. These Monumental and very Powerful Bases have become part of a Great American Heritage, and a..."
407,Incredible!  @FoxNews just took Congressional Hearing off the air just prior to important witness statements. More like CNN!!! Fox is lost!!!,2020-06-10 14:56:15,Incredible! @FoxNews just took Congressional Hearing off the air just prior to important witness statements. More like CNN!!! Fox is lost!!!
408,"Great statement to Congress by @Jim_Jordan concerning Defunding (not!) our great Police. This Radical Left agenda is not going to happen. Sleepy Joe Biden will be (already is) pulled all the way Left. Many, like Minneapolis, want to close their Police Departments. Crazy!",2020-06-10 14:33:19,"Great statement to Congress by @Jim_Jordan concerning Defunding (not!) our great Police. This Radical Left agenda is not going to happen. Sleepy Joe Biden will be (already is) pulled all the way Left. Many, like Minneapolis, want to close their Police Departments. Crazy!"
409,"“For the first time in history, Police Organizations & National Security Organizations were used to SPY on a Campaign, & there was no basis for it. The media largely drove that, & claims were made that could have affected the election of the President.” A.G. Bill Barr @BretBaier",2020-06-10 13:32:44,"“For the first time in history, Police Organizations & National Security Organizations were used to SPY on a Campaign, & there was no basis for it. The media largely drove that, & claims were made that could have affected the election of the President.” A.G. Bill Barr @BretBaier"
410,New York State is killing small businesses. Let them properly open! @foxandfriends,2020-06-10 12:51:05,New York State is killing small businesses. Let them properly open! @foxandfriends
411,"NASDAQ HITS ALL-TIME HIGH. Tremendous progress being made, way ahead of schedule. USA!",2020-06-10 12:49:28,"NASDAQ HITS ALL-TIME HIGH. Tremendous progress being made, way ahead of schedule. USA!"
414,“Republican AGs come out in force against defunding police” https://t.co/AAJiCHsqTp,2020-06-10 02:02:15,“Republican AGs come out in force against defunding police”
415,"Thank you George, great honor! https://t.co/1WzkcvLpnR",2020-06-10 00:45:02,"Thank you George, great honor!"
