,text,date,text_no_link
661,Big announcement for the State of Indiana! $77.5M committed in @USDOT funds for a “game-changing” transit project to provide fast and frequent service to the people of Indianapolis and Lawrence.,2020-05-28 22:15:48,Big announcement for the State of Indiana! $77.5M committed in @USDOT funds for a “game-changing” transit project to provide fast and frequent service to the people of Indianapolis and Lawrence.
662,"I’m excited to commit $100M to @MiamiDadeCounty, FL in @USDOT funding to connect fast-growing communities through state-of-the-art transit service! Fast, safe, and beautiful infrastructure!",2020-05-28 22:15:15,"I’m excited to commit $100M to @MiamiDadeCounty, FL in @USDOT funding to connect fast-growing communities through state-of-the-art transit service! Fast, safe, and beautiful infrastructure!"
663,.@USDOT is committing $21.8M for the FIRST transit project of this kind in the Tampa Bay region. It will connect St. Petersburg to popular beaches through state-of-the-art transit buses with FREE WiFi. Will be a major help to heavily populated parts of the Great State of Florida!,2020-05-28 21:43:53,.@USDOT is committing $21.8M for the FIRST transit project of this kind in the Tampa Bay region. It will connect St. Petersburg to popular beaches through state-of-the-art transit buses with FREE WiFi. Will be a major help to heavily populated parts of the Great State of Florida!
664,"Very exciting news for the Phoenix area—@USDOT is committing $100M to @valleymetro for a 5.5-mile light rail system with 9 new stations connecting underserved areas to churches, emergency services, and more!",2020-05-28 21:43:05,"Very exciting news for the Phoenix area—@USDOT is committing $100M to @valleymetro for a 5.5-mile light rail system with 9 new stations connecting underserved areas to churches, emergency services, and more!"
667,"So ridiculous to see Twitter trying to make the case that Mail-In Ballots are not subject to FRAUD. How stupid, there are examples, & cases, all over the place. Our election process will become badly tainted & a laughingstock all over the World. Tell that to your hater @yoyoel",2020-05-28 16:44:00,"So ridiculous to see Twitter trying to make the case that Mail-In Ballots are not subject to FRAUD. How stupid, there are examples, & cases, all over the place. Our election process will become badly tainted & a laughingstock all over the World. Tell that to your hater @yoyoel"
668,"The men and women of the National Guard have been doing a great job fighting the CoronaVirus. This week, I will extend their Title 32 orders through mid-August, so they can continue to help States succeed in their response and recovery efforts.",2020-05-28 16:20:11,"The men and women of the National Guard have been doing a great job fighting the CoronaVirus. This week, I will extend their Title 32 orders through mid-August, so they can continue to help States succeed in their response and recovery efforts."
669,"Thank you to our GREAT Republican Congressmen & Congresswomen on your incredibly important blockage last night of a FISA Bill that would just perpetuate the abuse that produced the Greatest Political Crime In the History of the U.S., the Russian Witch-Hunt. Fantastic Job!",2020-05-28 14:44:31,"Thank you to our GREAT Republican Congressmen & Congresswomen on your incredibly important blockage last night of a FISA Bill that would just perpetuate the abuse that produced the Greatest Political Crime In the History of the U.S., the Russian Witch-Hunt. Fantastic Job!"
670,"All over the World the CoronaVirus, a very bad “gift” from China, marches on. Not good!",2020-05-28 14:34:10,"All over the World the CoronaVirus, a very bad “gift” from China, marches on. Not good!"
671,"We have just reached a very sad milestone with the coronavirus pandemic deaths reaching 100,000. To all of the families & friends of those who have passed, I want to extend my heartfelt sympathy & love for everything that these great people stood for & represent. God be with you!",2020-05-28 13:37:57,"We have just reached a very sad milestone with the coronavirus pandemic deaths reaching 100,000. To all of the families & friends of those who have passed, I want to extend my heartfelt sympathy & love for everything that these great people stood for & represent. God be with you!"
672,This will be a Big Day for Social Media and FAIRNESS!,2020-05-28 12:37:57,This will be a Big Day for Social Media and FAIRNESS!
673,So many different viewpoints! https://t.co/DCesPbJu5M,2020-05-28 12:16:08,So many different viewpoints!
674,The greatest political crime in USA History! https://t.co/kyPZwHsBDQ,2020-05-28 11:59:56,The greatest political crime in USA History!
675,Yet she doesn’t let people even breath in Michigan. A very bad double standard! https://t.co/A60YxvWFGv,2020-05-28 11:57:46,Yet she doesn’t let people even breath in Michigan. A very bad double standard!
676,Trump on Russia Hoax: ‘When the Papers Come Out’ We Will Learn Obama ‘Knew Everything’ https://t.co/cugnMv1RuO,2020-05-28 11:53:00,Trump on Russia Hoax: ‘When the Papers Come Out’ We Will Learn Obama ‘Knew Everything’
677,Thank you Cowboys. See you in New Mexico! https://t.co/aCRJeskUA8,2020-05-28 04:00:34,Thank you Cowboys. See you in New Mexico!
678,He looks better! https://t.co/qzxn6Svlpc,2020-05-28 03:45:25,He looks better!
679,"Who else gave the less than elite (We are the elite. We know how to WIN!) 260 great new Federal Judges, 2 SCJ’s, Low Taxes, biggest ever REG. CUTS, Rebuilt Military, Choice, saved 2A & MUCH more? Not Sleepy Joe! Thank you Erick. https://t.co/wSabyoJ2GT",2020-05-28 02:35:58,"Who else gave the less than elite (We are the elite. We know how to WIN!) 260 great new Federal Judges, 2 SCJ’s, Low Taxes, biggest ever REG. CUTS, Rebuilt Military, Choice, saved 2A & MUCH more? Not Sleepy Joe! Thank you Erick."
680,Texas Supreme Court: Lack of immunity to COVID-19 alone not enough to vote by mail https://t.co/rAZVRF4nkj  Big win in Texas on the dangerous Mail In Voting Scam!,2020-05-28 02:07:37,Texas Supreme Court: Lack of immunity to COVID-19 alone not enough to vote by mail Big win in Texas on the dangerous Mail In Voting Scam!
681,"Big Tech is doing everything in their very considerable power to CENSOR in advance of the 2020 Election. If that happens, we no longer have our freedom. I will never let it happen! They tried hard in 2016, and lost. Now they are going absolutely CRAZY. Stay Tuned!!!",2020-05-28 01:36:55,"Big Tech is doing everything in their very considerable power to CENSOR in advance of the 2020 Election. If that happens, we no longer have our freedom. I will never let it happen! They tried hard in 2016, and lost. Now they are going absolutely CRAZY. Stay Tuned!!!"
684,"""He is arguably the greatest president in our history.” Thank you @LouDobbs! https://t.co/6dfy0yxu9l",2020-05-27 22:58:18,"""He is arguably the greatest president in our history.” Thank you @LouDobbs!"
685,"At my request, the FBI and the Department of Justice are already well into an investigation as to the very sad and tragic death in Minnesota of George Floyd....",2020-05-27 22:39:56,"At my request, the FBI and the Department of Justice are already well into an investigation as to the very sad and tragic death in Minnesota of George Floyd...."
686,"If the FISA Bill is passed tonight on the House floor, I will quickly VETO it. Our Country has just suffered through the greatest political crime in its history. The massive abuse of FISA was a big part of it!",2020-05-27 22:16:31,"If the FISA Bill is passed tonight on the House floor, I will quickly VETO it. Our Country has just suffered through the greatest political crime in its history. The massive abuse of FISA was a big part of it!"
687,Thank you to @NASA and @SpaceX for their hard work and leadership. Look forward to being back with you on Saturday!,2020-05-27 21:28:24,Thank you to @NASA and @SpaceX for their hard work and leadership. Look forward to being back with you on Saturday!
688,WARRANTLESS SURVEILLANCE OF AMERICANS IS WRONG!,2020-05-27 18:09:14,WARRANTLESS SURVEILLANCE OF AMERICANS IS WRONG!
689,Twitter has now shown that everything we have been saying about them (and their other compatriots) is correct. Big action to follow!,2020-05-27 14:22:20,Twitter has now shown that everything we have been saying about them (and their other compatriots) is correct. Big action to follow!
690,"The Radical Left Lamestream Media, together with their partner, the Do Nothing Democrats, are trying to spread a new narrative that President Trump was slow in reacting to Covid 19. Wrong, I was very fast, even doing the Ban on China long before anybody thought necessary!",2020-05-27 13:19:37,"The Radical Left Lamestream Media, together with their partner, the Do Nothing Democrats, are trying to spread a new narrative that President Trump was slow in reacting to Covid 19. Wrong, I was very fast, even doing the Ban on China long before anybody thought necessary!"
691,"Psycho Joe Scarborough is rattled, not only by his bad ratings but all of the things and facts that are coming out on the internet about opening a Cold Case. He knows what is happening!",2020-05-27 12:42:10,"Psycho Joe Scarborough is rattled, not only by his bad ratings but all of the things and facts that are coming out on the internet about opening a Cold Case. He knows what is happening!"
692,"We pass 15,000,000 Tests Today, by far the most in the World. Open Safely!",2020-05-27 11:59:01,"We pass 15,000,000 Tests Today, by far the most in the World. Open Safely!"
693,"We are acting as a police force, not the fighting force that we are, in Afghanistan. After 19 years, it is time for them to police their own Country. Bring our soldiers back home but closely watch what is going on and strike with a thunder like never before, if necessary!",2020-05-27 11:54:46,"We are acting as a police force, not the fighting force that we are, in Afghanistan. After 19 years, it is time for them to police their own Country. Bring our soldiers back home but closely watch what is going on and strike with a thunder like never before, if necessary!"
694,OBAMAGATE MAKES WATERGATE LOOK LIKE SMALL POTATOES!,2020-05-27 11:38:48,OBAMAGATE MAKES WATERGATE LOOK LIKE SMALL POTATOES!
695,"New papers make CLEAR that the Obama Administration SPIED, in an unprecedented manner, on the Trump Campaign and beyond, and even on the United States Senate. Nobody would ever have believed that this level of illegality and corruption would be taking place in our beautiful USA!",2020-05-27 11:31:43,"New papers make CLEAR that the Obama Administration SPIED, in an unprecedented manner, on the Trump Campaign and beyond, and even on the United States Senate. Nobody would ever have believed that this level of illegality and corruption would be taking place in our beautiful USA!"
696,"We have informed both India and China that the United States is ready, willing and able to mediate or arbitrate their now raging border dispute. Thank you!",2020-05-27 11:21:28,"We have informed both India and China that the United States is ready, willing and able to mediate or arbitrate their now raging border dispute. Thank you!"
697,"Republicans feel that Social Media Platforms totally silence conservatives voices. We will strongly regulate, or close them down, before we can ever allow this to happen. We saw what they attempted to do, and failed, in 2016. We can’t let a more sophisticated version of that....",2020-05-27 11:11:52,"Republicans feel that Social Media Platforms totally silence conservatives voices. We will strongly regulate, or close them down, before we can ever allow this to happen. We saw what they attempted to do, and failed, in 2016. We can’t let a more sophisticated version of that...."
698,Former CBS Reporter One Of The First ‘To Identify Myself As A Target of Illegal Spying Under Obama Admin’ https://t.co/JlqGygcWYq,2020-05-27 03:54:51,Former CBS Reporter One Of The First ‘To Identify Myself As A Target of Illegal Spying Under Obama Admin’
699,"Congratulations to author Nick Adams on the @simonschuster publication of your new book, “Trump and Churchill, Defenders of Western Civilization”. Certainly a great honor to be compared, in any way, to Winston Churchill.  @NickAdamsinUSA",2020-05-27 02:42:53,"Congratulations to author Nick Adams on the @simonschuster publication of your new book, “Trump and Churchill, Defenders of Western Civilization”. Certainly a great honor to be compared, in any way, to Winston Churchill. @NickAdamsinUSA"
700,"The Failing @nytimes, winner of @PulitzerPrizes for its totally flawed coverage of the illegal Russia Witch Hunt, does its research as follows: Think of the absolute worst things you can say about Donald J. Trump, pretend there are sources, and just say it. RETURN THE PULITZERS!",2020-05-27 02:31:10,"The Failing @nytimes, winner of @PulitzerPrizes for its totally flawed coverage of the illegal Russia Witch Hunt, does its research as follows: Think of the absolute worst things you can say about Donald J. Trump, pretend there are sources, and just say it. RETURN THE PULITZERS!"
701,"Great News: The boring but very nasty magazine, The Atlantic, is rapidly failing, going down the tubes, and has just been forced to announce it is laying off at least 20% of its staff in order to limp into the future. This is a tough time to be in the Fake News Business!",2020-05-27 02:16:28,"Great News: The boring but very nasty magazine, The Atlantic, is rapidly failing, going down the tubes, and has just been forced to announce it is laying off at least 20% of its staff in order to limp into the future. This is a tough time to be in the Fake News Business!"
702,".@Twitter is now interfering in the 2020 Presidential Election. They are saying my statement on Mail-In Ballots, which will lead to massive corruption and fraud, is incorrect, based on fact-checking by Fake News CNN and the Amazon Washington Post....",2020-05-26 23:40:10,".@Twitter is now interfering in the 2020 Presidential Election. They are saying my statement on Mail-In Ballots, which will lead to massive corruption and fraud, is incorrect, based on fact-checking by Fake News CNN and the Amazon Washington Post...."
703,"I hope all Republican House Members vote NO on FISA until such time as our Country is able to determine how and why the greatest political, criminal, and subversive scandal in USA history took place!",2020-05-26 23:21:13,"I hope all Republican House Members vote NO on FISA until such time as our Country is able to determine how and why the greatest political, criminal, and subversive scandal in USA history took place!"
704,"Didn’t Obama, whose Administration has now been caught cold illegally spying on the Trump campaign, recently also get caught playing golf on a course in Virginia, despite his wife Michelle urging people to stay home, before and after his round, in a major public service message?",2020-05-26 19:37:26,"Didn’t Obama, whose Administration has now been caught cold illegally spying on the Trump campaign, recently also get caught playing golf on a course in Virginia, despite his wife Michelle urging people to stay home, before and after his round, in a major public service message?"
705,"How brilliant are our FARMERS? Thank you @lgutwein99_31, real talent! #MAGA https://t.co/mtzbqUFd1V",2020-05-26 15:48:33,"How brilliant are our FARMERS? Thank you @lgutwein99_31, real talent! #MAGA"
706,"For all of the political hacks out there, if I hadn’t done my job well, & early, we would have lost 1 1/2 to 2 Million People, as opposed to the 100,000 plus that looks like will be the number. That’s 15 to 20 times more than we will lose. I shut down entry from China very early!",2020-05-26 15:18:20,"For all of the political hacks out there, if I hadn’t done my job well, & early, we would have lost 1 1/2 to 2 Million People, as opposed to the 100,000 plus that looks like will be the number. That’s 15 to 20 times more than we will lose. I shut down entry from China very early!"
707,"We made most Governors look very good, even great, by getting them the Ventilators, unlimited Testing, and supplies, all of which they should have had in their own stockpiles. So they look great, and I just keep rolling along, doing great things and getting Fake Lamestream News!",2020-05-26 15:01:26,"We made most Governors look very good, even great, by getting them the Ventilators, unlimited Testing, and supplies, all of which they should have had in their own stockpiles. So they look great, and I just keep rolling along, doing great things and getting Fake Lamestream News!"
708,"Stock Market up BIG, DOW crosses 25,000. S&P 500 over 3000. States should open up ASAP. The Transition to Greatness has started, ahead of schedule. There will be ups and downs, but next year will be one of the best ever!",2020-05-26 13:45:49,"Stock Market up BIG, DOW crosses 25,000. S&P 500 over 3000. States should open up ASAP. The Transition to Greatness has started, ahead of schedule. There will be ups and downs, but next year will be one of the best ever!"
709,"The opening of a Cold Case against Psycho Joe Scarborough was not a Donald Trump original thought, this has been going on for years, long before I joined the chorus. In 2016 when Joe & his wacky future ex-wife, Mika, would endlessly interview me, I would always be thinking....",2020-05-26 13:19:14,"The opening of a Cold Case against Psycho Joe Scarborough was not a Donald Trump original thought, this has been going on for years, long before I joined the chorus. In 2016 when Joe & his wacky future ex-wife, Mika, would endlessly interview me, I would always be thinking...."
710,"Sean Parnell is an American Hero. Conor Lamb has proven to be an American fraud, and a puppet for Crazy Nancy Pelosi. He said he would NOT vote for her for Speaker, and did. Will kill 2A. Voted to impeach (on nothing). A TOTAL & COMPLETE Sean Parnell Endorsement! https://t.co/v1OnY0MI8m",2020-05-26 12:25:11,"Sean Parnell is an American Hero. Conor Lamb has proven to be an American fraud, and a puppet for Crazy Nancy Pelosi. He said he would NOT vote for her for Speaker, and did. Will kill 2A. Voted to impeach (on nothing). A TOTAL & COMPLETE Sean Parnell Endorsement!"
711,"There is NO WAY (ZERO!) that Mail-In Ballots will be anything less than substantially fraudulent. Mail boxes will be robbed, ballots will be forged & even illegally printed out & fraudulently signed. The Governor of California is sending Ballots to millions of people, anyone.....",2020-05-26 12:17:53,"There is NO WAY (ZERO!) that Mail-In Ballots will be anything less than substantially fraudulent. Mail boxes will be robbed, ballots will be forged & even illegally printed out & fraudulently signed. The Governor of California is sending Ballots to millions of people, anyone....."
712,Joe Biden’s handling of the H1N1 Swine Flu was a complete and total disaster. Even polls on the matter were terrible!,2020-05-26 12:05:44,Joe Biden’s handling of the H1N1 Swine Flu was a complete and total disaster. Even polls on the matter were terrible!
714,"Great reviews on our handling of Covid 19, sometimes referred to as the China Virus. Ventilators, Testing, Medical Supply Distribution, we made a lot of Governors look very good - And got no credit for so doing. Most importantly, we helped a lot of great people!",2020-05-25 20:16:06,"Great reviews on our handling of Covid 19, sometimes referred to as the China Virus. Ventilators, Testing, Medical Supply Distribution, we made a lot of Governors look very good - And got no credit for so doing. Most importantly, we helped a lot of great people!"
715,"Nobody in 50 years has been WEAKER on China than Sleepy Joe Biden. He was asleep at the wheel. He gave them EVERYTHING they wanted, including rip-off Trade Deals. I am getting it all back!",2020-05-25 20:05:34,"Nobody in 50 years has been WEAKER on China than Sleepy Joe Biden. He was asleep at the wheel. He gave them EVERYTHING they wanted, including rip-off Trade Deals. I am getting it all back!"
716,"Sleepy Joe Biden (mostly his reps.) went crazy when I banned, in late January, people coming in from China. He called me “xenophobic” & then went equally “nuts” when we let in 44,000 people - until he was told they were American citizens coming home. He later apologized!",2020-05-25 20:00:26,"Sleepy Joe Biden (mostly his reps.) went crazy when I banned, in late January, people coming in from China. He called me “xenophobic” & then went equally “nuts” when we let in 44,000 people - until he was told they were American citizens coming home. He later apologized!"
717,"I have zero interest in moving the Republican National Convention to Doral in Miami, as falsely reported by the Fake News @nytimes in order to stir up trouble. Ballroom is not nearly big enough & would like to stay in N.C., whose gov. doesn’t even know if he can let people in? https://t.co/nqBBPv4VXS",2020-05-25 18:29:39,"I have zero interest in moving the Republican National Convention to Doral in Miami, as falsely reported by the Fake News @nytimes in order to stir up trouble. Ballroom is not nearly big enough & would like to stay in N.C., whose gov. doesn’t even know if he can let people in?"
719,"Some stories about the fact that in order to get outside and perhaps, even a little exercise, I played golf over the weekend. The Fake & Totally Corrupt News makes it sound like a mortal sin - I knew this would happen! What they don’t say is that it was my first golf in almost...",2020-05-25 13:31:52,"Some stories about the fact that in order to get outside and perhaps, even a little exercise, I played golf over the weekend. The Fake & Totally Corrupt News makes it sound like a mortal sin - I knew this would happen! What they don’t say is that it was my first golf in almost..."
722,"TRANSITION TO GREATNESS! Get ready, it is already happening again!",2020-05-25 12:18:36,"TRANSITION TO GREATNESS! Get ready, it is already happening again!"
723,HAPPY MEMORIAL DAY!,2020-05-25 12:16:20,HAPPY MEMORIAL DAY!
724,"I love the Great State of North Carolina, so much so that I insisted on having the Republican National Convention in Charlotte at the end of August. Unfortunately, Democrat Governor, @RoyCooperNC is still in Shutdown mood & unable to guarantee that by August we will be allowed...",2020-05-25 12:12:06,"I love the Great State of North Carolina, so much so that I insisted on having the Republican National Convention in Charlotte at the end of August. Unfortunately, Democrat Governor, @RoyCooperNC is still in Shutdown mood & unable to guarantee that by August we will be allowed..."
725,MAKE AMERICA GREAT AGAIN!,2020-05-25 03:06:47,MAKE AMERICA GREAT AGAIN!
726,OBAMAGATE!,2020-05-25 03:06:14,OBAMAGATE!
727,Schools in our country should be opened ASAP. Much very good information now available. @SteveHiltonx @FoxNews,2020-05-25 02:41:14,Schools in our country should be opened ASAP. Much very good information now available. @SteveHiltonx @FoxNews
728,"Having the G7 meeting in Washington is very important for those countries, and the World! https://t.co/tWECoIlu6F",2020-05-25 02:16:06,"Having the G7 meeting in Washington is very important for those countries, and the World!"
729,"Among many other very important events, meetings, and calls! https://t.co/0yNFtFpXpv",2020-05-25 02:13:20,"Among many other very important events, meetings, and calls!"
730,"I give, and have given from the beginning, my entire yearly salary, $400,000 to $450,000, back to our government. Last check to HHS Covid relief. My great honor! https://t.co/Vv6Uyz9MkF",2020-05-25 01:57:23,"I give, and have given from the beginning, my entire yearly salary, $400,000 to $450,000, back to our government. Last check to HHS Covid relief. My great honor!"
731,"Sleepy Joe’s representatives have just put out an ad saying that I went to play golf (exercise) today. They think I should stay in the White House at all times. What they didn’t say is that it’s the first time I’ve played golf in almost 3 months, that Biden was constantly.....",2020-05-25 01:46:17,"Sleepy Joe’s representatives have just put out an ad saying that I went to play golf (exercise) today. They think I should stay in the White House at all times. What they didn’t say is that it’s the first time I’ve played golf in almost 3 months, that Biden was constantly....."
732,"The Democrats are trying to Rig the 2020 Election, plain and simple! https://t.co/jlDhzGRnqa",2020-05-25 00:38:54,"The Democrats are trying to Rig the 2020 Election, plain and simple!"
733,A disgrace. Total corruption! https://t.co/OH9rdeQUS9,2020-05-25 00:31:39,A disgrace. Total corruption!
734,Thank you. We love our boaters! https://t.co/AhjmAOKfDh,2020-05-25 00:25:42,Thank you. We love our boaters!
736,"Be sure to watch, “Witch Hunt, the Flynn Vindication” hosted by the very knowledgeable @GreggJarrett on @FoxNews tonight at 8:00 P.M. This is yet another part of the greatest Criminal Hoax in American History!",2020-05-24 22:51:58,"Be sure to watch, “Witch Hunt, the Flynn Vindication” hosted by the very knowledgeable @GreggJarrett on @FoxNews tonight at 8:00 P.M. This is yet another part of the greatest Criminal Hoax in American History!"
737,You are right! https://t.co/MWUq0yf8ii,2020-05-24 20:11:43,You are right!
738,"I always stand with leaders who weren’t afraid to stand early with me. That’s why I am supporting a true conservative, @DanJohnstonND for State Treasurer of North Dakota! https://t.co/CDkKewRcYz",2020-05-24 17:16:35,"I always stand with leaders who weren’t afraid to stand early with me. That’s why I am supporting a true conservative, @DanJohnstonND for State Treasurer of North Dakota!"
