,text,date,text_no_link
1,POLITICAL WITCH HUNT!,2020-07-09 16:14:01,POLITICAL WITCH HUNT!
2,"We have a totally corrupt previous Administration, including a President and Vice President who spied on my campaign, AND GOT CAUGHT...and nothing happens to them. This crime was taking place even before my election, everyone knows it, and yet all are frozen stiff with fear....",2020-07-09 15:35:13,"We have a totally corrupt previous Administration, including a President and Vice President who spied on my campaign, AND GOT CAUGHT...and nothing happens to them. This crime was taking place even before my election, everyone knows it, and yet all are frozen stiff with fear...."
3,Courts in the past have given “broad deference”. BUT NOT ME!,2020-07-09 14:38:59,Courts in the past have given “broad deference”. BUT NOT ME!
4,"The Supreme Court sends case back to Lower Court, arguments to continue. This is all a political prosecution. I won the Mueller Witch Hunt, and others, and now I have to keep fighting in a politically corrupt New York. Not fair to this Presidency or Administration!",2020-07-09 14:38:12,"The Supreme Court sends case back to Lower Court, arguments to continue. This is all a political prosecution. I won the Mueller Witch Hunt, and others, and now I have to keep fighting in a politically corrupt New York. Not fair to this Presidency or Administration!"
5,PROSECUTORIAL MISCONDUCT!,2020-07-09 12:52:08,PROSECUTORIAL MISCONDUCT!
6,"“We know what took place. We have already seen criminality. What is happening? Biggest political scandal of our time.” @MariaBartiromo You are 100% correct, Maria, it is a disgrace that nothing happens. Obama and Biden spied on my campaign, AND GOT CAUGHT...BUT NOTHING!",2020-07-09 12:50:55,"“We know what took place. We have already seen criminality. What is happening? Biggest political scandal of our time.” @MariaBartiromo You are 100% correct, Maria, it is a disgrace that nothing happens. Obama and Biden spied on my campaign, AND GOT CAUGHT...BUT NOTHING!"
7,PRESIDENTIAL HARASSMENT!,2020-07-09 12:40:52,PRESIDENTIAL HARASSMENT!
8,"For the 1/100th time, the reason we show so many Cases, compared to other countries that haven’t done nearly as well as we have, is that our TESTING is much bigger and better. We have tested 40,000,000 people. If we did 20,000,000 instead, Cases would be half, etc. NOT REPORTED!",2020-07-09 12:39:33,"For the 1/100th time, the reason we show so many Cases, compared to other countries that haven’t done nearly as well as we have, is that our TESTING is much bigger and better. We have tested 40,000,000 people. If we did 20,000,000 instead, Cases would be half, etc. NOT REPORTED!"
9,"THANK YOU! #MAGA2020 
https://t.co/Eecj1gGGHS",2020-07-09 03:45:13,THANK YOU! #MAGA2020
11,"Congratulations to Jeff @VanDrewForNJ on a Great Primary run, and big VICTORY against a very tough opponent! #MAGA2020 https://t.co/5bBZwQkGmv",2020-07-08 16:09:27,"Congratulations to Jeff @VanDrewForNJ on a Great Primary run, and big VICTORY against a very tough opponent! #MAGA2020"
12,"Economy and Jobs are growing MUCH faster than anyone (except me!) expected. Job growth is biggest in history. China Virus Mortality Rate is among the LOWEST of any country. Shaping up for a good third quarter, and a great next year! NASDAQ at new record high, 401k’s way up!!!!",2020-07-08 13:50:41,"Economy and Jobs are growing MUCH faster than anyone (except me!) expected. Job growth is biggest in history. China Virus Mortality Rate is among the LOWEST of any country. Shaping up for a good third quarter, and a great next year! NASDAQ at new record high, 401k’s way up!!!!"
13,"I disagree with @CDCgov on their very tough & expensive guidelines for opening schools. While they want them open, they are asking schools to do very impractical things. I will be meeting with them!!!",2020-07-08 13:33:57,"I disagree with @CDCgov on their very tough & expensive guidelines for opening schools. While they want them open, they are asking schools to do very impractical things. I will be meeting with them!!!"
14,"In Germany, Denmark, Norway,  Sweden and many other countries, SCHOOLS ARE OPEN WITH NO PROBLEMS. The Dems think it would be bad for them politically if U.S. schools open before the November Election, but is important for the children & families. May cut off funding if not open!",2020-07-08 13:16:38,"In Germany, Denmark, Norway, Sweden and many other countries, SCHOOLS ARE OPEN WITH NO PROBLEMS. The Dems think it would be bad for them politically if U.S. schools open before the November Election, but is important for the children & families. May cut off funding if not open!"
15,"We will miss GREAT Country Rocker, Charlie Daniels, who passed away yesterday in Hermitage, Tennessee. My condolences to his wife Hazel, and their family. Charlie is in my thoughts and prayers. I love his music! #RIPCharlieDaniels",2020-07-07 23:47:31,"We will miss GREAT Country Rocker, Charlie Daniels, who passed away yesterday in Hermitage, Tennessee. My condolences to his wife Hazel, and their family. Charlie is in my thoughts and prayers. I love his music! #RIPCharlieDaniels"
18,"“COVID-19 (China Virus) Death Rate PLUNGES From Peak In U.S.” A Tenfold Decrease In Mortality. The Washington Times @WashTimes  Valerie Richardson.  We have the lowest Mortality Rate in the World. The Fake News should be reporting these most important of facts, but they don’t!",2020-07-07 12:52:40,"“COVID-19 (China Virus) Death Rate PLUNGES From Peak In U.S.” A Tenfold Decrease In Mortality. The Washington Times @WashTimes Valerie Richardson. We have the lowest Mortality Rate in the World. The Fake News should be reporting these most important of facts, but they don’t!"
19,“President Trump champions American greatness in his Mount Rushmore speech.” @seanhannity @FoxNews,2020-07-07 02:46:02,“President Trump champions American greatness in his Mount Rushmore speech.” @seanhannity @FoxNews
20,"The highly respected Henry Ford Health System just reported, based on a large sampling, that HYDROXYCHLOROQUINE cut the death rate in certain sick patients very significantly. The Dems disparaged it for political reasons (me!). Disgraceful. Act now @US_FDA @TuckerCarlson @FoxNews",2020-07-07 02:32:35,"The highly respected Henry Ford Health System just reported, based on a large sampling, that HYDROXYCHLOROQUINE cut the death rate in certain sick patients very significantly. The Dems disparaged it for political reasons (me!). Disgraceful. Act now @US_FDA @TuckerCarlson @FoxNews"
21,"Wall is moving fast in Texas, Arizona, New Mexico and California. Great numbers at the Southern Border. Dems want people to just flow in. They want very dangerous open Borders! https://t.co/gGuYzpTa9t",2020-07-07 02:00:12,"Wall is moving fast in Texas, Arizona, New Mexico and California. Great numbers at the Southern Border. Dems want people to just flow in. They want very dangerous open Borders!"
23,"Why does the Lamestream Fake News Media REFUSE to say that China Virus deaths are down 39%, and that we now have the lowest Fatality (Mortality) Rate in the World. They just can’t stand that we are doing so well for our Country!",2020-07-06 20:17:46,"Why does the Lamestream Fake News Media REFUSE to say that China Virus deaths are down 39%, and that we now have the lowest Fatality (Mortality) Rate in the World. They just can’t stand that we are doing so well for our Country!"
24,"Corrupt Joe Biden and the Democrats don’t want to open schools in the Fall for political reasons, not for health reasons! They think it will help them in November. Wrong, the people get it!",2020-07-06 20:11:42,"Corrupt Joe Biden and the Democrats don’t want to open schools in the Fall for political reasons, not for health reasons! They think it will help them in November. Wrong, the people get it!"
26,"The Democrats would not have BANNED travel from heavily infected China, especially so early, therefore, far more people would have died. Corrupt Joe Biden now admits this!!!",2020-07-06 18:44:09,"The Democrats would not have BANNED travel from heavily infected China, especially so early, therefore, far more people would have died. Corrupt Joe Biden now admits this!!!"
27,SCHOOLS MUST OPEN IN THE FALL!!!,2020-07-06 18:40:10,SCHOOLS MUST OPEN IN THE FALL!!!
28,"“Treatment with hydroxychloroquine cut the death rate significantly in sick patients hospitalized with COVID-19 – and without heart-related side-effects, according to a new study published by Henry Ford Health System. In a large-scale retrospective analysis...",2020-07-06 18:36:59,"“Treatment with hydroxychloroquine cut the death rate significantly in sick patients hospitalized with COVID-19 – and without heart-related side-effects, according to a new study published by Henry Ford Health System. In a large-scale retrospective analysis..."
29,"BREAKING NEWS: The Mortality Rate for the China Virus in the U.S. is just about the LOWEST IN THE WORLD! Also, Deaths in the U.S. are way down, a tenfold decrease since the Pandemic height (and, our Economy is coming back strong!).",2020-07-06 18:36:50,"BREAKING NEWS: The Mortality Rate for the China Virus in the U.S. is just about the LOWEST IN THE WORLD! Also, Deaths in the U.S. are way down, a tenfold decrease since the Pandemic height (and, our Economy is coming back strong!)."
30,"Deaths from the China Virus are down 39%, while our great testing program continues to lead the World, by FAR! Why isn’t the Fake News reporting that Deaths are way down? It is only because they are, indeed, FAKE NEWS!",2020-07-06 18:24:06,"Deaths from the China Virus are down 39%, while our great testing program continues to lead the World, by FAR! Why isn’t the Fake News reporting that Deaths are way down? It is only because they are, indeed, FAKE NEWS!"
31,"They name teams out of STRENGTH, not weakness, but now the Washington Redskins & Cleveland Indians, two fabled sports franchises, look like they are going to be changing their names in order to be politically correct. Indians, like Elizabeth Warren, must be very angry right now!",2020-07-06 18:13:16,"They name teams out of STRENGTH, not weakness, but now the Washington Redskins & Cleveland Indians, two fabled sports franchises, look like they are going to be changing their names in order to be politically correct. Indians, like Elizabeth Warren, must be very angry right now!"
32,NASDAQ HITS ALL TIME HIGH!,2020-07-06 13:39:13,NASDAQ HITS ALL TIME HIGH!
33,"“This is no longer about peaceful protesting, this is about angry, violent, criminal mobs taking over certain (Democrat run) cities. It is a lack of political leadership in that city.” Chad Wolf @DHSgov @foxandfriends @NYGovCuomo @NYCMayor",2020-07-06 13:31:53,"“This is no longer about peaceful protesting, this is about angry, violent, criminal mobs taking over certain (Democrat run) cities. It is a lack of political leadership in that city.” Chad Wolf @DHSgov @foxandfriends @NYGovCuomo @NYCMayor"
34,"New York City and Chicago play the Sanctuary City card, where criminals are protected. Perhaps they will have to start changing their ways (and thinking!).",2020-07-06 13:17:46,"New York City and Chicago play the Sanctuary City card, where criminals are protected. Perhaps they will have to start changing their ways (and thinking!)."
35,"Has @BubbaWallace apologized to all of those great NASCAR drivers & officials who came to his aid, stood by his side, & were willing to sacrifice everything for him, only to find out that the whole thing was just another HOAX? That & Flag decision has caused lowest ratings EVER!",2020-07-06 12:33:07,"Has @BubbaWallace apologized to all of those great NASCAR drivers & officials who came to his aid, stood by his side, & were willing to sacrifice everything for him, only to find out that the whole thing was just another HOAX? That & Flag decision has caused lowest ratings EVER!"
36,China has caused great damage to the United States and the rest of the World!,2020-07-06 12:28:26,China has caused great damage to the United States and the rest of the World!
37,"If you want your 401k’s  and Stocks, which are getting close to an all time high (NASDAQ is already there), to disintegrate and disappear, vote for the Radical Left Do Nothing Democrats and Corrupt Joe Biden. Massive Tax Hikes - They will make you very poor, FAST!",2020-07-06 12:26:47,"If you want your 401k’s and Stocks, which are getting close to an all time high (NASDAQ is already there), to disintegrate and disappear, vote for the Radical Left Do Nothing Democrats and Corrupt Joe Biden. Massive Tax Hikes - They will make you very poor, FAST!"
38,Statue of Frederick Douglass Torn Down in Rochester https://t.co/8iEBxSHm52 via @BreitbartNews. This shows that these anarchists have no bounds!,2020-07-06 12:13:52,Statue of Frederick Douglass Torn Down in Rochester via @BreitbartNews. This shows that these anarchists have no bounds!
39,"New China Virus Cases up (because of massive testing), deaths are down, “low and steady”. The Fake News Media should report this and also, that new job numbers are setting records!",2020-07-05 22:34:33,"New China Virus Cases up (because of massive testing), deaths are down, “low and steady”. The Fake News Media should report this and also, that new job numbers are setting records!"
40,Democrats want to Defund & Abolish Police. This despite poor crime numbers in cities that they run. CRAZY!,2020-07-05 21:29:36,Democrats want to Defund & Abolish Police. This despite poor crime numbers in cities that they run. CRAZY!
41,"Chicago and New York City crime numbers are way up. 67 people shot in Chicago, 13 killed. Shootings up significantly in NYC where people are demanding that @NYGovCuomo & @NYCMayor act now. Federal Government ready, willing and able to help, if asked!",2020-07-05 21:20:51,"Chicago and New York City crime numbers are way up. 67 people shot in Chicago, 13 killed. Shootings up significantly in NYC where people are demanding that @NYGovCuomo & @NYCMayor act now. Federal Government ready, willing and able to help, if asked!"
42,.@FoxNews weekend afternoons is the worst! Getting into @CNN and MSDNC territory. Watch @OANN & @newsmax instead. Much better!,2020-07-05 21:05:50,.@FoxNews weekend afternoons is the worst! Getting into @CNN and MSDNC territory. Watch @OANN & @newsmax instead. Much better!
43,".@FoxNews gladly puts up the phony suppression polls as soon as they come out. We are leading in the REAL polls because people are sick & tired of watching the Democrat run cities, in all cases, falling apart. Also, now 96% Approval Rating in the Republican Party. Another 2016!",2020-07-05 20:47:26,".@FoxNews gladly puts up the phony suppression polls as soon as they come out. We are leading in the REAL polls because people are sick & tired of watching the Democrat run cities, in all cases, falling apart. Also, now 96% Approval Rating in the Republican Party. Another 2016!"
44,"Wow. @CNN got caught cold manipulating the words and meaning of my 4th of July Speech. They were brazen, desperate. Watch what happens!",2020-07-05 05:32:20,"Wow. @CNN got caught cold manipulating the words and meaning of my 4th of July Speech. They were brazen, desperate. Watch what happens!"
45,"On this wonderful day, we celebrate our history, our heroes, our heritage, our flag, and our FREEDOM. Happy Fourth of July to Everyone! #SaluteToAmerica https://t.co/hdPIu30KK1",2020-07-05 03:48:54,"On this wonderful day, we celebrate our history, our heroes, our heritage, our flag, and our FREEDOM. Happy Fourth of July to Everyone! #SaluteToAmerica"
47,Will be speaking at 7:00 P.M. Thank you for all of the nice comments on the Mount Rushmore speech last night!!!,2020-07-04 20:19:07,Will be speaking at 7:00 P.M. Thank you for all of the nice comments on the Mount Rushmore speech last night!!!
48,Big 4th of July Air Show soon coming down the East Coast. Get ready to look up to the sky. Check local listings!,2020-07-04 20:14:51,Big 4th of July Air Show soon coming down the East Coast. Get ready to look up to the sky. Check local listings!
49,Would lead to disaster! https://t.co/rDB69MKz6f,2020-07-04 20:03:59,Would lead to disaster!
50,....The Fake News Media is being laughed at all over the world! https://t.co/TRX8XdaKgg,2020-07-04 20:03:07,....The Fake News Media is being laughed at all over the world!
51,"This would be the beginning of the end. He has no clue, but he wouldn’t be calling the shots!!! https://t.co/cHnSh3p69N",2020-07-04 19:56:04,"This would be the beginning of the end. He has no clue, but he wouldn’t be calling the shots!!!"
52,"...And if the Federal Government wasn’t getting ready to go in, and we were all set, it would still be a squatter’s (anarchist’s) mess! https://t.co/DHjxI7DkYu",2020-07-04 19:52:47,"...And if the Federal Government wasn’t getting ready to go in, and we were all set, it would still be a squatter’s (anarchist’s) mess!"
53,"Cases, Cases, Cases! If we didn’t test so much and so successfully, we would have very few cases. If you test 40,000,000 people, you are going to have many cases that, without the testing (like other countries), would not show up every night on the Fake Evening News.....",2020-07-04 18:49:56,"Cases, Cases, Cases! If we didn’t test so much and so successfully, we would have very few cases. If you test 40,000,000 people, you are going to have many cases that, without the testing (like other countries), would not show up every night on the Fake Evening News....."
54,“Change Hearts Not Stones. There is no end to historical purification.” Great historian Doug Wead,2020-07-04 17:57:48,“Change Hearts Not Stones. There is no end to historical purification.” Great historian Doug Wead
55,Thank you my friend. America loves India! https://t.co/mlvJ51l8XJ,2020-07-04 17:38:54,Thank you my friend. America loves India!
56,Great! https://t.co/cVw4iQmqRU,2020-07-04 17:37:21,Great!
57,The @nytimes is a very corrupt and dishonest media outlet that suffers TDS at a level rarely seen. They will lose any remaining credibility on the evening of November 3rd. https://t.co/SuwZAIem2u,2020-07-04 17:20:00,The @nytimes is a very corrupt and dishonest media outlet that suffers TDS at a level rarely seen. They will lose any remaining credibility on the evening of November 3rd.
59,"An amazing guy. Burgess is what we need in Washington, tough and smart!!! https://t.co/9ns8tJj1J4",2020-07-04 16:56:07,"An amazing guy. Burgess is what we need in Washington, tough and smart!!!"
60,"Sara, the Silent Majority will speak on NOVEMBER 3rd. You are doing a Great job &, together with some very well known others who got it right on Russia, Russia, Russia, should get a now very discredited Pulitzer Prize. Committee should get them back from those that got it wrong! https://t.co/GIvz5fWVOg",2020-07-04 16:48:25,"Sara, the Silent Majority will speak on NOVEMBER 3rd. You are doing a Great job &, together with some very well known others who got it right on Russia, Russia, Russia, should get a now very discredited Pulitzer Prize. Committee should get them back from those that got it wrong!"
62,Thank you Tammy. You have quickly become a great voice for freedom! https://t.co/5JRqWqFFfm,2020-07-04 16:07:59,Thank you Tammy. You have quickly become a great voice for freedom!
65,Jim Banks: New York Times Damaged National Security to Hurt Trump https://t.co/6jT8bLIFYf via @BreitbartNews Thank you Jim. They are Fake News!,2020-07-04 05:16:37,Jim Banks: New York Times Damaged National Security to Hurt Trump via @BreitbartNews Thank you Jim. They are Fake News!
67,Congressman Jeff Van Drew (@VanDrewForNJ) is a Courageous Leader who defended me against Pelosi’s Impeachment Scam and is a conservative who shares our Republican values. Jeff is a fighter for South Jersey and will always put America First. Vote for Jeff! https://t.co/whoUDnen12,2020-07-03 21:12:48,Congressman Jeff Van Drew (@VanDrewForNJ) is a Courageous Leader who defended me against Pelosi’s Impeachment Scam and is a conservative who shares our Republican values. Jeff is a fighter for South Jersey and will always put America First. Vote for Jeff!
68,"Congressman @DrPaulGosar is a tremendous supporter of our #MAGA agenda! He is Strong on the Wall, Law Enforcement and the Second Amendment, and he always puts America First! Paul has my Complete and Total Endorsement. #AZ04 https://t.co/fzRBYCsB1i",2020-07-03 21:12:29,"Congressman @DrPaulGosar is a tremendous supporter of our #MAGA agenda! He is Strong on the Wall, Law Enforcement and the Second Amendment, and he always puts America First! Paul has my Complete and Total Endorsement. #AZ04"
69,"Tony Gonzales (@TonyGonzales4TX) will be a GREAT Congressman for Texas! A Navy veteran, he is Strong on the Economy, Life and the Second Amendment. We need him to defeat the Radical Left in November. Tony has my Complete and Total Endorsement! #TX23 https://t.co/WZcKDEOYn7",2020-07-03 21:12:20,"Tony Gonzales (@TonyGonzales4TX) will be a GREAT Congressman for Texas! A Navy veteran, he is Strong on the Economy, Life and the Second Amendment. We need him to defeat the Radical Left in November. Tony has my Complete and Total Endorsement! #TX23"
70,"Christina Hagan (@RepHagan) will be an incredible Congresswoman for the working families of Northeast Ohio. An early supporter of our #MAGA agenda, she is Strong on Jobs, Border Security and your Second Amendment. Christina is running against an absolute failure, Tim Ryan, who...",2020-07-03 21:11:55,"Christina Hagan (@RepHagan) will be an incredible Congresswoman for the working families of Northeast Ohio. An early supporter of our #MAGA agenda, she is Strong on Jobs, Border Security and your Second Amendment. Christina is running against an absolute failure, Tim Ryan, who..."
71,".@RonnyJackson4TX is a spectacular man. An Admiral in the Navy, he is a brave and loyal Warrior who loves our Military and Vets. As a medical doctor, Ronny is great on HealthCare and he is Strong on Cutting Taxes, the Border and the Second Amendment...",2020-07-03 21:09:12,".@RonnyJackson4TX is a spectacular man. An Admiral in the Navy, he is a brave and loyal Warrior who loves our Military and Vets. As a medical doctor, Ronny is great on HealthCare and he is Strong on Cutting Taxes, the Border and the Second Amendment..."
72,"My friend, @BillHagertyTN, will be a phenomenal Senator for Tennessee! He did an incredible job for our country as Ambassador to Japan. Strong on the Economy, Trade and the Wall, Bill stands Tall for Law & Order. He has my Complete and Total Endorsement! https://t.co/VGeHlAfQV8",2020-07-03 21:08:37,"My friend, @BillHagertyTN, will be a phenomenal Senator for Tennessee! He did an incredible job for our country as Ambassador to Japan. Strong on the Economy, Trade and the Wall, Bill stands Tall for Law & Order. He has my Complete and Total Endorsement!"
73,"Congratulations, @BurgessOwens, on your impressive primary victory! A Super Bowl Champion, Burgess knows how to WIN. Strong on Life, Military, Vets and the #2A, he will always fight for Utah. Burgess has my Complete and Total Endorsement! #UT04 https://t.co/UppUx24FXx",2020-07-03 21:07:53,"Congratulations, @BurgessOwens, on your impressive primary victory! A Super Bowl Champion, Burgess knows how to WIN. Strong on Life, Military, Vets and the #2A, he will always fight for Utah. Burgess has my Complete and Total Endorsement! #UT04"
74,"NASDAQ HAD ITS 23RD RECORD CLOSE OF THE YEAR. OTHER EXCHANGES ARE FOLLOWING CLOSELY BEHIND. TREMENDOUS POTENTIAL REMAINING. BIG MONTHS UPCOMING. NEXT YEAR, DEPENDING ON AN ELECTION WIN, WILL BE ONE OF THE BEST EVER! @LouDobbs",2020-07-03 12:12:26,"NASDAQ HAD ITS 23RD RECORD CLOSE OF THE YEAR. OTHER EXCHANGES ARE FOLLOWING CLOSELY BEHIND. TREMENDOUS POTENTIAL REMAINING. BIG MONTHS UPCOMING. NEXT YEAR, DEPENDING ON AN ELECTION WIN, WILL BE ONE OF THE BEST EVER! @LouDobbs"
75,"Actually, a must read. Really good! https://t.co/SM7xBuuwPe",2020-07-03 03:50:36,"Actually, a must read. Really good!"
76,"There is a rise in Coronavirus cases because our testing is so massive and so good, far bigger and better than any other country. This is great news, but even better news is that death, and the death rate, is DOWN. Also, younger people, who get better much easier and faster!",2020-07-03 03:44:42,"There is a rise in Coronavirus cases because our testing is so massive and so good, far bigger and better than any other country. This is great news, but even better news is that death, and the death rate, is DOWN. Also, younger people, who get better much easier and faster!"
77,He cannot pass the test I “aced”. He should give it a try!!! https://t.co/4U6pny2D6y,2020-07-03 03:25:18,He cannot pass the test I “aced”. He should give it a try!!!
78,MAKE AMERICA GREAT AGAIN!,2020-07-03 00:19:23,MAKE AMERICA GREAT AGAIN!
79,LAW & ORDER!,2020-07-03 00:17:52,LAW & ORDER!
80,"Mail-In Ballots will lead to massive electoral fraud and a rigged 2020 Election. Look at all of the cases and examples that are out there right now, with the Patterson, N.J., being the most recent example. Republicans, in particular, cannot let this happen!",2020-07-02 23:41:58,"Mail-In Ballots will lead to massive electoral fraud and a rigged 2020 Election. Look at all of the cases and examples that are out there right now, with the Patterson, N.J., being the most recent example. Republicans, in particular, cannot let this happen!"
