,text,date,text_no_link
1031,"Vote @MikeGarcia2020 by May 12th! His opponent @ChristyforCA25 voted to fire teachers, and cut their salaries while bumping up her pay. Now she’s mocking our Great Vets! We need Navy Fighter Pilot Mike Garcia in #CA25! https://t.co/MEnGMvl8it",2020-05-08 21:50:40,"Vote @MikeGarcia2020 by May 12th! His opponent @ChristyforCA25 voted to fire teachers, and cut their salaries while bumping up her pay. Now she’s mocking our Great Vets! We need Navy Fighter Pilot Mike Garcia in #CA25!"
1032,"Tom Tiffany (@TomTiffanyWI) is a Great Advocate for the incredible people of Wisconsin (WI07). We need Tom in Congress to help us Make America Great Again! He will Fight for Small Business, supports our Incredible Farmers, Loves our Military and our Vets....",2020-05-08 21:50:15,"Tom Tiffany (@TomTiffanyWI) is a Great Advocate for the incredible people of Wisconsin (WI07). We need Tom in Congress to help us Make America Great Again! He will Fight for Small Business, supports our Incredible Farmers, Loves our Military and our Vets...."
1036,"Retired Ice Director Tom Homan knows more about the Border and Border Security than anyone. He’s a tough guy, but a good guy - and as smart as they come. His new book, “Defend The Border and Save Lives: Solving Our Most Important Humanitarian and Security Crisis” is a....",2020-05-08 16:58:26,"Retired Ice Director Tom Homan knows more about the Border and Border Security than anyone. He’s a tough guy, but a good guy - and as smart as they come. His new book, “Defend The Border and Save Lives: Solving Our Most Important Humanitarian and Security Crisis” is a...."
1037,DRAIN THE SWAMP!,2020-05-08 11:29:39,DRAIN THE SWAMP!
1038,"Yesterday was a BIG day for Justice in the USA. Congratulations to General Flynn, and many others. I do believe there is MUCH more to come! Dirty Cops and Crooked Politicians do not go well together!",2020-05-08 11:18:13,"Yesterday was a BIG day for Justice in the USA. Congratulations to General Flynn, and many others. I do believe there is MUCH more to come! Dirty Cops and Crooked Politicians do not go well together!"
1039,I will be interviewed on @foxandfriends at 8:00 A.M. Enjoy!,2020-05-08 11:11:43,I will be interviewed on @foxandfriends at 8:00 A.M. Enjoy!
1042,"Today, @FLOTUS celebrates the two year anniversary of #BeBest, her initiative dedicated to bringing awareness to issues that impact the lives of children. Congratulations, and thank you! https://t.co/3jM5GfSvfg https://t.co/dvh1MnzcFK",2020-05-07 18:36:34,"Today, @FLOTUS celebrates the two year anniversary of #BeBest, her initiative dedicated to bringing awareness to issues that impact the lives of children. Congratulations, and thank you!"
1043,"Congratulations to former Governor of New Jersey, Chris Christie, and all others involved, on a complete and total exoneration (with a 9-0 vote by the U.S. Supreme Court) on the Obama DOJ Scam referred to as “Bridgegate.” The Democrats....",2020-05-07 17:27:25,"Congratulations to former Governor of New Jersey, Chris Christie, and all others involved, on a complete and total exoneration (with a 9-0 vote by the U.S. Supreme Court) on the Obama DOJ Scam referred to as “Bridgegate.” The Democrats...."
1044,"As you know, I designated this day to be a National Day of Prayer. As our Nation heals, our Spirit has never been Stronger! https://t.co/WWhvzsSDWq",2020-05-07 16:25:56,"As you know, I designated this day to be a National Day of Prayer. As our Nation heals, our Spirit has never been Stronger!"
1046,The Fake News has reached an all time high!,2020-05-06 15:16:53,The Fake News has reached an all time high!
1047,"The White House CoronaVirus Task Force, headed by Vice President Mike Pence, has done a fantastic job of bringing together vast highly complex resources that have set a high standard for others to follow in the future. Ventilators, which were few & in bad shape, are now being....",2020-05-06 13:05:58,"The White House CoronaVirus Task Force, headed by Vice President Mike Pence, has done a fantastic job of bringing together vast highly complex resources that have set a high standard for others to follow in the future. Ventilators, which were few & in bad shape, are now being...."
1048,Thank you @Honeywell! https://t.co/4jH6NF63XI,2020-05-06 03:22:09,Thank you @Honeywell!
1050,"I was thrilled to be back in the Great State of Arizona with the incredible, patriotic, and hardworking men and women of @Honeywell! https://t.co/z8XOjmFquB",2020-05-05 22:06:11,"I was thrilled to be back in the Great State of Arizona with the incredible, patriotic, and hardworking men and women of @Honeywell!"
1051,Will be doing a major interview tonight at 6:30 P.M. Eastern with @DavidMuir on @ABCWorldNews Tonight.,2020-05-05 20:25:31,Will be doing a major interview tonight at 6:30 P.M. Eastern with @DavidMuir on @ABCWorldNews Tonight.
1052,"On #NationalTeacherDay, we recognize the countless men and women who dedicate their lives to instilling character, integrity, and knowledge in the hearts and minds of our Nation’s students, thank you! https://t.co/sai1FMR1fp",2020-05-05 19:25:14,"On #NationalTeacherDay, we recognize the countless men and women who dedicate their lives to instilling character, integrity, and knowledge in the hearts and minds of our Nation’s students, thank you!"
1053,Getting ready to land in the Great State of Arizona!,2020-05-05 18:51:34,Getting ready to land in the Great State of Arizona!
1054,"Wow! Congratulations to Greg Gutfeld, a one time Trump Hater who has come all the way home. His Ratings easily beat no talent Stephen Colbert, nice guy Jimmy Fallon, and wacko “last placer” Jimmy Kimmel. Greg built his show from scratch, and did a great job in doing so. @FoxNews",2020-05-05 18:50:20,"Wow! Congratulations to Greg Gutfeld, a one time Trump Hater who has come all the way home. His Ratings easily beat no talent Stephen Colbert, nice guy Jimmy Fallon, and wacko “last placer” Jimmy Kimmel. Greg built his show from scratch, and did a great job in doing so. @FoxNews"
1055,"Well run States should not be bailing out poorly run States, using CoronaVirus as the excuse! The elimination of Sanctuary Cities, Payroll Taxes, and perhaps Capital Gains Taxes, must be put on the table. Also lawsuit indemnification & business deductions for restaurants & ent.",2020-05-05 18:37:54,"Well run States should not be bailing out poorly run States, using CoronaVirus as the excuse! The elimination of Sanctuary Cities, Payroll Taxes, and perhaps Capital Gains Taxes, must be put on the table. Also lawsuit indemnification & business deductions for restaurants & ent."
1056,"Most of the money raised by the RINO losers of the so-called “Lincoln Project”, goes into their own pockets. With what I’ve done on Judges, Taxes, Regulations, Healthcare, the Military, Vets (Choice!) & protecting our great 2A, they should love Trump. Problem is, I BEAT THEM ALL!",2020-05-05 18:18:26,"Most of the money raised by the RINO losers of the so-called “Lincoln Project”, goes into their own pockets. With what I’ve done on Judges, Taxes, Regulations, Healthcare, the Military, Vets (Choice!) & protecting our great 2A, they should love Trump. Problem is, I BEAT THEM ALL!"
1057,Remember this? Happy #CincoDeMayo! https://t.co/1jDZHNTHHj,2020-05-05 17:35:53,Remember this? Happy #CincoDeMayo!
1058,"The Do Nothing Democrats and their leader, the Fake News Lamestream Media, are doing everything possible to hurt and disparage our Country. No matter what we do or say, no matter how big a win, they report that it was a loss, or not good enough. The Enemy of the People!",2020-05-05 16:55:29,"The Do Nothing Democrats and their leader, the Fake News Lamestream Media, are doing everything possible to hurt and disparage our Country. No matter what we do or say, no matter how big a win, they report that it was a loss, or not good enough. The Enemy of the People!"
1059,"For the constant criticism from the Do Nothing Democrats and their Fake News partners, here is the newest chart on our great testing “miracle"" compared to other countries. Dems and LameStream Media should be proud of the USA, instead of always ripping us down! https://t.co/8AwnPCNchF",2020-05-05 16:52:10,"For the constant criticism from the Do Nothing Democrats and their Fake News partners, here is the newest chart on our great testing “miracle"" compared to other countries. Dems and LameStream Media should be proud of the USA, instead of always ripping us down!"
1060,"Governors should let roads and highway construction begin before heavy traffic starts, which will be soon. Some Governors never stopped, which proved to be very smart. They built and fixed roads during long no traffic periods. Also, saved big dollars!",2020-05-05 13:13:29,"Governors should let roads and highway construction begin before heavy traffic starts, which will be soon. Some Governors never stopped, which proved to be very smart. They built and fixed roads during long no traffic periods. Also, saved big dollars!"
1061,Heading to Arizona!,2020-05-05 12:39:33,Heading to Arizona!
1062,Oil prices moving up nicely as demand begins again!,2020-05-05 12:36:07,Oil prices moving up nicely as demand begins again!
1063,Exciting to see our Country starting to open up again! https://t.co/My5yPSZdS3,2020-05-05 12:33:32,Exciting to see our Country starting to open up again!
1064,"A group of RINO Republicans who failed badly 12 years ago, then again 8 years ago, and then got BADLY beaten by me, a political first timer, 4 years ago, have copied (no imagination) the concept of an ad from Ronald Reagan, “Morning in America”, doing everything possible to....",2020-05-05 04:46:31,"A group of RINO Republicans who failed badly 12 years ago, then again 8 years ago, and then got BADLY beaten by me, a political first timer, 4 years ago, have copied (no imagination) the concept of an ad from Ronald Reagan, “Morning in America”, doing everything possible to...."
1065,THANK YOU #USNSComfort! https://t.co/Hp89n5xGIK,2020-05-05 02:45:35,THANK YOU #USNSComfort!
1066,MSDNC and FAKE NEWS CNN are going wild trying to protect China!,2020-05-04 22:35:30,MSDNC and FAKE NEWS CNN are going wild trying to protect China!
1067,"A great new book, “Fortitude: American Resilience in the Era of Outrage” by former Navy Seal, and current Texas Congressman @DanCrenshawTX, is now available. A fantastic guy — get your copy today! https://t.co/7EqltABxbe",2020-05-04 22:35:02,"A great new book, “Fortitude: American Resilience in the Era of Outrage” by former Navy Seal, and current Texas Congressman @DanCrenshawTX, is now available. A fantastic guy — get your copy today!"
1068,"Interesting? By Congress not wanting the special 5 minute testing apparatus, they are saying that they are not “essential”.  In any event, we have great testing capacity, and have performed 6.5 million tests, which is more than every country in the world, combined!",2020-05-04 14:24:08,"Interesting? By Congress not wanting the special 5 minute testing apparatus, they are saying that they are not “essential”. In any event, we have great testing capacity, and have performed 6.5 million tests, which is more than every country in the world, combined!"
1069,"Mexico is sadly experiencing very big CoronaVirus problems, and now California, get this, doesn’t want people coming over the Southern Border. A Classic! They are sooo lucky that I am their President. Border is very tight and the Wall is rapidly being built!",2020-05-04 13:42:13,"Mexico is sadly experiencing very big CoronaVirus problems, and now California, get this, doesn’t want people coming over the Southern Border. A Classic! They are sooo lucky that I am their President. Border is very tight and the Wall is rapidly being built!"
1070,"Republicans love the biggest Tax Cuts, Rebuilt Military, Choice for Vets, saving 2nd Amendment and many other things my Administration has done, but what they love beyond all else is 252 (so far!) Federal Judges, not including two great Supreme Court Justices. A Big Record!",2020-05-04 13:36:33,"Republicans love the biggest Tax Cuts, Rebuilt Military, Choice for Vets, saving 2nd Amendment and many other things my Administration has done, but what they love beyond all else is 252 (so far!) Federal Judges, not including two great Supreme Court Justices. A Big Record!"
1071,"And I’m Endorsing you also Lacy, you truly deserve it. You are doing a great job, and Omar is a disaster who wants much higher taxes, hates our Military & our Vets, demands Open Borders, and is fighting to take away our great 2nd Amendment. Good luck Lacy! https://t.co/RunIPCbTyc",2020-05-04 12:31:46,"And I’m Endorsing you also Lacy, you truly deserve it. You are doing a great job, and Omar is a disaster who wants much higher taxes, hates our Military & our Vets, demands Open Borders, and is fighting to take away our great 2nd Amendment. Good luck Lacy!"
1072,"Getting great reviews, finally, for how well we are handling the pandemic, especially our strong production of desperately needed ventilators, the building of field hospitals & beds, and soon, the great things we are doing on testing. People are really working well together!",2020-05-04 12:19:45,"Getting great reviews, finally, for how well we are handling the pandemic, especially our strong production of desperately needed ventilators, the building of field hospitals & beds, and soon, the great things we are doing on testing. People are really working well together!"
1073,"“Concast” should open up a long overdue Florida Cold Case against Psycho Joe Scarborough. I know him and Crazy Mika well, used them beautifully in the last Election, dumped them nicely, and will state on the record that he is “nuts”. Besides, bad ratings! #OPENJOECOLDCASE",2020-05-04 10:38:11,"“Concast” should open up a long overdue Florida Cold Case against Psycho Joe Scarborough. I know him and Crazy Mika well, used them beautifully in the last Election, dumped them nicely, and will state on the record that he is “nuts”. Besides, bad ratings! #OPENJOECOLDCASE"
1074,I’m with the TRUCKERS all the way. Thanks for the meeting at the White House with my representatives from the Administration. It is all going to work out well!,2020-05-04 02:42:50,I’m with the TRUCKERS all the way. Thanks for the meeting at the White House with my representatives from the Administration. It is all going to work out well!
1077,Thank you Ryan. Working hard! https://t.co/ZnYgTI3Qux,2020-05-03 20:41:08,Thank you Ryan. Working hard!
1078,"Intelligence has just reported to me that I was correct, and that they did NOT bring up the CoronaVirus subject matter until late into January, just prior to my banning China from the U.S. Also, they only spoke of the Virus in a very non-threatening, or matter of fact, manner...",2020-05-03 20:18:19,"Intelligence has just reported to me that I was correct, and that they did NOT bring up the CoronaVirus subject matter until late into January, just prior to my banning China from the U.S. Also, they only spoke of the Virus in a very non-threatening, or matter of fact, manner..."
1079,Thank you very much to our beautiful “boaters.” I will never let you down! https://t.co/Ot5Ffnjj9G,2020-05-03 18:10:00,Thank you very much to our beautiful “boaters.” I will never let you down!
1080,"....And then came a Plague, a great and powerful Plague, and the World was never to be the same again! But America rose from this death and destruction, always remembering its many lost souls, and the lost souls all over the World, and became greater than ever before!",2020-05-03 14:43:31,"....And then came a Plague, a great and powerful Plague, and the World was never to be the same again! But America rose from this death and destruction, always remembering its many lost souls, and the lost souls all over the World, and became greater than ever before!"
1081,So nice to see this great honor. Thank you (but haven’t played golf in a long time)! https://t.co/FfJyUmRdGi,2020-05-03 14:36:19,So nice to see this great honor. Thank you (but haven’t played golf in a long time)!
1082,Going well despite the Fake News! https://t.co/WXqcomjahx,2020-05-03 14:30:44,Going well despite the Fake News!
1083,Some things never get old! https://t.co/0GHkJjNbZL,2020-05-03 13:00:38,Some things never get old!
1084,Progress being made! https://t.co/cqHKwJCJNm,2020-05-03 12:57:40,Progress being made!
1085,Thank you! https://t.co/GAFe1AdZpt,2020-05-03 12:56:15,Thank you!
1086,Keep punching Mike! https://t.co/QwFcFQ8B5O,2020-05-03 12:54:31,Keep punching Mike!
1087,Thank you! https://t.co/s3aLt9qTVZ,2020-05-03 12:52:37,Thank you!
1088,Wow! https://t.co/90GHsQRBAB,2020-05-03 12:49:43,Wow!
1089,"Hopefully our Country will soon mend. We are all missing our wonderful rallies, and many other things! https://t.co/LX8TyBzsXO",2020-05-03 12:46:51,"Hopefully our Country will soon mend. We are all missing our wonderful rallies, and many other things!"
1090,"Many complaints coming in about Maine. I love that State, won Maine 2 - Don’t make the cure worse than the problem itself. That can happen, you know! https://t.co/XsAiTWDx44",2020-05-03 12:20:05,"Many complaints coming in about Maine. I love that State, won Maine 2 - Don’t make the cure worse than the problem itself. That can happen, you know!"
1091,"The Fake News doesn’t show real polls. Lamestream Media is totally CORRUPT, the Enemy of the People! https://t.co/Agwb3u5QFd",2020-05-03 11:57:19,"The Fake News doesn’t show real polls. Lamestream Media is totally CORRUPT, the Enemy of the People!"
1092,".@PeteHegseth  “Oh bye the way, I appreciate the message from former President Bush, but where was he during Impeachment calling for putting partisanship aside.” @foxandfriends  He was nowhere to be found in speaking up against the greatest Hoax in American history!",2020-05-03 11:42:16,".@PeteHegseth “Oh bye the way, I appreciate the message from former President Bush, but where was he during Impeachment calling for putting partisanship aside.” @foxandfriends He was nowhere to be found in speaking up against the greatest Hoax in American history!"
1093,"Beautiful, thank you to our GREAT @BlueAngels and @AFThunderbirds! https://t.co/42ftZmOlQe",2020-05-03 03:30:19,"Beautiful, thank you to our GREAT @BlueAngels and @AFThunderbirds!"
1094,"No reason to turn it down, except politics. We have plenty of testing. Maybe you need a new Doctor over there. Crazy Nancy will use it as an excuse not to show up to work! https://t.co/NucH4dbKBL",2020-05-02 23:04:53,"No reason to turn it down, except politics. We have plenty of testing. Maybe you need a new Doctor over there. Crazy Nancy will use it as an excuse not to show up to work!"
1095,"The Democrats are just, as always, looking for trouble. They do nothing constructive, even in times of crisis. They don’t want to blame their cash cow, China, for the plague. China is blaming Europe. Dr. Fauci will be testifying before the Senate very soon! #DONOTHINGDEMOCRATS https://t.co/fgHuYeiOQY",2020-05-02 23:00:39,"The Democrats are just, as always, looking for trouble. They do nothing constructive, even in times of crisis. They don’t want to blame their cash cow, China, for the plague. China is blaming Europe. Dr. Fauci will be testifying before the Senate very soon! #DONOTHINGDEMOCRATS"
1096,Not much time to sleep. Thank you! https://t.co/ilWlYrdfh1,2020-05-02 22:32:38,Not much time to sleep. Thank you!
1097,"So true, although Honest Abe wasn’t bad. Thank you! https://t.co/Bb4736mgxa",2020-05-02 22:26:23,"So true, although Honest Abe wasn’t bad. Thank you!"
1098,"She was thrown off The View like a dog, Zero T.V. Personas. Now Wallace is a 3rd rate lapdog for Fake News MSDNC (Concast). Doesn’t have what it takes! https://t.co/F8azYEJHm5",2020-05-02 21:51:30,"She was thrown off The View like a dog, Zero T.V. Personas. Now Wallace is a 3rd rate lapdog for Fake News MSDNC (Concast). Doesn’t have what it takes!"
1099,Very cool. Please thank him! https://t.co/7nc79fCFip,2020-05-02 21:34:47,Very cool. Please thank him!
1100,"I, for one, am glad to see he is back, and well! https://t.co/mIWVeRMnOJ",2020-05-02 21:24:13,"I, for one, am glad to see he is back, and well!"
1101,"Border Wall is going up FAST. Over 172 miles already built. 450 miles by early next year, or sooner! Dems want OPEN BORDERS. I want STRONG BORDERS! https://t.co/ZvOo2xYdom",2020-05-02 21:14:35,"Border Wall is going up FAST. Over 172 miles already built. 450 miles by early next year, or sooner! Dems want OPEN BORDERS. I want STRONG BORDERS!"
1102,"The Impeachment Hoax will be exposed. Crazy Nancy gets Nothing Done, that’s why she got thrown out as Speaker the first time. Also, she should come back to Washington now! https://t.co/stKjtzPJNZ",2020-05-02 21:07:34,"The Impeachment Hoax will be exposed. Crazy Nancy gets Nothing Done, that’s why she got thrown out as Speaker the first time. Also, she should come back to Washington now!"
1103,"I hate to be promoting AT&T, but @OANN is Great News, not Fake News. Everybody should be carrying them! https://t.co/b2fx9w0zqq",2020-05-02 20:49:24,"I hate to be promoting AT&T, but @OANN is Great News, not Fake News. Everybody should be carrying them!"
1104,That’s right Jack. Keep up the good work! https://t.co/q8DdMbW0hl,2020-05-02 20:36:12,That’s right Jack. Keep up the good work!
1106,Thank you Michael. You also! https://t.co/VFi6Nhj3zG,2020-05-02 17:02:15,Thank you Michael. You also!
1107,The Russia Hoax is the biggest political scandal in American history. Treason!!! Lets see how it ends???? https://t.co/VRsVdiQrsf,2020-05-02 16:56:46,The Russia Hoax is the biggest political scandal in American history. Treason!!! Lets see how it ends????
1108,Thank you! https://t.co/LSGA6Tg0zk,2020-05-02 14:21:02,Thank you!
1109,"96% Approval Rating in the Republican Party. Thank you! Also, just out, highest ever Approval Rating overall in the new Gallup Poll, and shows “Trump beating Sleepy Joe Biden.”",2020-05-02 13:17:42,"96% Approval Rating in the Republican Party. Thank you! Also, just out, highest ever Approval Rating overall in the new Gallup Poll, and shows “Trump beating Sleepy Joe Biden.”"
1110,"There is tremendous CoronaVirus testing capacity in Washington for the Senators returning to Capital Hill on Monday. Likewise the House, which should return but isn’t because of Crazy Nancy P. The 5 minute Abbott Test will be used. Please inform Dr. Brian P. Monahan. @MarkMeadows",2020-05-02 13:06:53,"There is tremendous CoronaVirus testing capacity in Washington for the Senators returning to Capital Hill on Monday. Likewise the House, which should return but isn’t because of Crazy Nancy P. The 5 minute Abbott Test will be used. Please inform Dr. Brian P. Monahan. @MarkMeadows"
1112,Don’t allow RIGGED ELECTIONS! https://t.co/DeZ5B3TEv5,2020-05-01 23:36:20,Don’t allow RIGGED ELECTIONS!
1116,"Senator Shelley Moore Capito (@CapitoforWV) is doing a tremendous job for the great people of West Virginia! She strongly defends our Second Amendment, Supports our Veterans and is Strong on Life and the Border....",2020-05-01 20:05:58,"Senator Shelley Moore Capito (@CapitoforWV) is doing a tremendous job for the great people of West Virginia! She strongly defends our Second Amendment, Supports our Veterans and is Strong on Life and the Border...."
1117,Concast (@NBCNews) and Fake News @CNN are going out of their way to say GREAT things about China. They are Chinese puppets who want to do business there. They use USA airwaves to help China. The Enemy of the People!,2020-05-01 15:27:29,Concast (@NBCNews) and Fake News @CNN are going out of their way to say GREAT things about China. They are Chinese puppets who want to do business there. They use USA airwaves to help China. The Enemy of the People!
1118,"The Governor of Michigan should give a little, and put out the fire. These are very good people, but they are angry. They want their lives back again, safely! See them, talk to them, make a deal.",2020-05-01 12:42:23,"The Governor of Michigan should give a little, and put out the fire. These are very good people, but they are angry. They want their lives back again, safely! See them, talk to them, make a deal."
1119,"Cryin Chuck Schumer, compared to what other Senators have brought home to their states, has brought very little back to N.Y. A totally overrated loser, the one thing he has given them is SALT. He never even called me to stop it. No wonder Cuomo & most others can’t stand him. AOC!",2020-05-01 12:14:36,"Cryin Chuck Schumer, compared to what other Senators have brought home to their states, has brought very little back to N.Y. A totally overrated loser, the one thing he has given them is SALT. He never even called me to stop it. No wonder Cuomo & most others can’t stand him. AOC!"
1120,"Cryin’ Chuck Schumer was on a late night show using a false talking point over & over again. “We don’t have enough testing ,” he would repeat, when he knows we have done a great job on Testing, just like we have on Ventilators and everything else. He lied, gave NY SALT. Run AOC!",2020-05-01 12:07:51,"Cryin’ Chuck Schumer was on a late night show using a false talking point over & over again. “We don’t have enough testing ,” he would repeat, when he knows we have done a great job on Testing, just like we have on Ventilators and everything else. He lied, gave NY SALT. Run AOC!"
1121,Dirty Cop! https://t.co/xrB4PYTV0J,2020-05-01 11:55:42,Dirty Cop!
1122,"I have done more for farmers and ranchers than any President in history, and it has been my honor in doing so! https://t.co/YcCznszW7P",2020-05-01 11:54:13,"I have done more for farmers and ranchers than any President in history, and it has been my honor in doing so!"
